question,type,paraphased_q_score,context,answer,answer_score,paraphased_q_answer_score
Doanh nghiệp thực hiện phân tích kinh doanh thế nào?,root,,"AI chuyên dụng là AI sử dụng dữ liệu đế giải quyết các vấn đề cụ thể và ta có thể nói phân tích kinh doanh là việc ứng dụng ba cấp độ phân tích dữ liệu (phân tích mô tả, phân tích dự đoán và phân tích khuyến cáo) vào sáu bài toán chính của kinh doanh (quản lý sản xuất, tài chính, thị trường, bán hàng, khách hàng và nhân sự).
Phân tích kinh doanh là công cụ AI trong kinh doanh, là công cụ làm kinh tế số của doanh nghiệp trong thời chuyển đổi số.","Doanh nghiệp có thể thực hiện phân tích kinh doanh thông qua việc sử dụng các công nghệ mới nhất như thống kê, học máy và khai phá dữ liệu. Phân tích kinh doanh bao gồm ba cấp độ chính là mô tả, dự đoán và khuyên cáo. Ở mức mô tả, doanh nghiệp có thể dùng phương pháp thống kê để phân tích dữ liệu nhằm hiểu rõ tình hình hiện tại của mình. Mức dự đoán cho phép doanh nghiệp sử dụng học máy và khai phá dữ liệu để đưa ra quyết định dựa trên các xu hướng trong tương lai. Cuối cùng, mức khuyên cáo kết hợp học máy và toán học để đề xuất những hành động cụ thể mà doanh nghiệp có thể thực hiện nhằm tối ưu hóa hoạt động của mình.",,
Phương pháp nào để doanh nghiệp thực hiện phân tích kinh doanh?,paraphased,,,"3 cấp độ của phân tích kinh doanh là mô tả, dự đoán và khuyên cáo. Doanh nghiệp có thể sử dụng các công nghệ mới nhất như thống kê, học máy, khai phá dữ liệu (AI) để thực hiện phân tích kinh doanh. Các phương pháp này giúp thấu hiểu và quyết định kinh doanh hiệu quả hơn.",,
Làm thế nào để doanh nghiệp tiến hành phân tích kinh doanh?,paraphased,,,"Doanh nghiệp có thể tiến hành phân tích kinh doanh thông qua việc sử dụng các hệ thống và công cụ như Hệ thống hỗ trợ quyết định (DSS), Hệ thống hoạch định nguồn lực doanh nghiệp (ERP), Hệ thống thông tin điều hành doanh nghiệp (EIS) và Hệ thống phân tích kinh doanh (BA). Các hệ thống này dựa trên việc sử dụng dữ liệu và mô hình toán học để tính toán, hỗ trợ cho các hoạt động cơ bản của doanh nghiệp, quản lý hàng ngày và ra quyết định thông minh.",,
Doanh nghiệp thực hiện phân tích kinh doanh bằng cách nào?,paraphased,,,"Doanh nghiệp có thể thực hiện phân tích kinh doanh thông qua các công cụ, phần mềm chuyên dụng và phương pháp tiếp cận khác nhau. Một số trong đó bao gồm:
        1. Phần mềm BI (Business Intelligence) : Các nền tảng này cho phép doanh nghiệp thu thập, lưu trữ và xử lý dữ liệu từ nhiều nguồn khác nhau như hệ thống CRM, ERP hoặc các công cụ phân tích mạng xã hội để tạo ra những hiểu biết sâu sắc về hành vi khách hàng, xu hướng thị trường và hiệu quả hoạt động.
        2. Phần mềm trực quan hóa dữ liệu: Các phần mềm này giúp doanh nghiệp trình bày thông tin phức tạp dưới dạng biểu đồ, đồ thị hoặc bản đồ tương tác dễ hiểu hơn. Điều này cho phép các nhà quản lý đưa ra quyết định dựa trên cơ sở bằng chứng và xác định xu hướng cũng như mô hình trong dữ liệu của họ
        3. Phân tích dự đoán: Bằng cách sử dụng thuật toán học máy (machine learning ), doanh nghiệp có thể phân tích lượng lớn dữ liệu để dự báo kết quả tương lai, chẳng hạn như hành vi khách hàng hoặc hiệu suất tài chính. Điều này giúp các nhà quản lý đưa ra quyết định sáng suốt và chủ động hơn
        4. Phân tích cạnh tranh: Doanh nghiệp cũng có thể sử dụng công cụ phân tích cạnh tranh để theo dõi đối thủ của mình trên thị trường, xác định điểm mạnh và điểm yếu của họ, đồng thời tìm kiếm cơ hội mới cho sự phát triển.
        5. Phần mềm quản lý quan hệ khách hàng (CRM) : Các nền tảng này giúp doanh nghiệp thu thập và phân tích dữ liệu về hành vi, sở thích và tương tác của khách hàng để cải thiện trải nghiệm tổng thể của họ với công ty. Điều này có thể dẫn đến tăng lòng trung thành của khách hàng và kinh doanh lặp lại
        6. Phân tích mạng xã hội: Bằng cách theo dõi các cuộc trò chuyện trên phương tiện truyền thông xã hội, doanh nghiệp có thể hiểu rõ hơn về nhận thức của người tiêu dùng đối với thương hiệu hoặc sản phẩm của họ cũng như xác định xu hướng và cơ hội mới để tiếp thị.
        7. Phân tích dữ liệu lớn: Các công cụ này cho phép doanh nghiệp phân tích lượng lớn dữ liệu từ nhiều nguồn khác nhau, chẳng hạn như mạng xã hội, cảm biến thiết bị và giao dịch thương mại điện tử để đưa ra những hiểu biết sâu sắc về hành vi của khách hàng, xu hướng thị trường và hiệu quả hoạt động.
        8. Phân tích chuỗi cung ứng: Các công cụ này giúp doanh nghiệp tối ưu hóa quy trình quản lý chuỗi cung ứng bằng cách phân tích dữ liệu từ các nhà cung cấp, nhà sản xuất và kho bãi để xác định điểm nghẽn tiềm năng và cơ hội cải thiện hiệu quả.",,
Vai trò của dữ liệu với doanh nghiệp trong kỷ nguyên số?,root,,"Theo truyền thống ứng dụng CNTT, dữ liệu được tạo ra thông qua nhiều phép đo hoạch định sẵn (từ khảo sát khách hàng đến kho hàng) như một phần của quy trình sản xuất, kinh doanh, bán hàng, tiếp thị. Dữ liệu thu được sử dụng chủ yếu để đánh giá, dự báo và ra quyết định.
Ngược lại, ngày nay chúng ta phải đối mặt với lượng dữ liệu lớn chưa tùng thấy, phần lớn là không cấu trúc, từ mọi cuộc trò chuyện, tương tác hoặc quá trình bên trong hoặc bên ngoài các doanh nghiệp. Các công cụ của AI cho phép doanh nghiệp đưa ra các cách dự đoán mới, khám phá xu hướng mới trong hoạt động kinh doanh và giải mã các ngưồn giá trị mới. Thay vì bị giới hạn trong các bộ phận R&D, dữ liệu đang trở thành huyết mạch của mọi bộ phận trong doanh nghiệp và là tài sàn chiến lược cần xây dựng và khai thác.
Dữ liệu là một yếu tố sống còn của doanh nghiệp. ","Trong kỷ nguyên số, dữ liệu đóng vai trò quan trọng đối với các doanh nghiệp. Nó giúp họ sáng tạo ra những sản phẩm và dịch vụ thông minh, cá thể hóa bằng cách sử dụng phân tích dữ liệu hoặc trí tuệ nhân tạo (AI). Ngoài ra, dữ liệu cũng được dùng để tối ưu hóa quy trình hoạt động và quản trị một cách thông minh. Hạ tầng số mạnh mẽ đóng vai trò như hệ thần kinh của địa phương, kết nối các chủ thể bên trong địa phương, giúp họ xử lý tình huống phát sinh kịp thời và chính xác hơn. Do đó, việc chuyển đổi số là cần thiết đối với doanh nghiệp để thích nghi với kỷ nguyên số này.",,
Dữ liệu đóng vai trò gì đối với doanh nghiệp trong kỷ nguyên số?,paraphased,,,"Dữ liệu đóng vai trò quan trọng đối với doanh nghiệp trong kỷ nguyên số, vì nó là nền tảng của quá trình chuyển đổi số. Doanh nghiệp cần thu thập và phân tích dữ liệu để hiểu rõ hơn về khách hàng, tối ưu hóa hoạt động và đưa ra quyết định dựa trên dữ liệu. Dữ liệu giúp doanh nghiệp xác định xu hướng thị trường, cải thiện trải nghiệm khách hàng và tạo lợi thế cạnh tranh trong môi trường kinh doanh số ngày càng phát triển nhanh chóng.",,
"Trong kỷ nguyên số, vai trò của dữ liệu với doanh nghiệp là gì?",paraphased,,,"Trong kỷ nguyên số, dữ liệu đóng vai trò quan trọng đối với các doanh nghiệp. Nó được xem như ""bộ nhớ"" của doanh nghiệp, nơi lưu giữ tri thức về khách hàng, thị trường và sản phẩm. Các CIO (Chief Information Officer) tập trung suy nghĩ vào dữ liệu, trong khi các doanh nghiệp lớn thậm chí còn tạo ra vị trí Giám đốc dữ liệu CDO hoặc chuyển đổi chức năng CIO thành CDO. Việc nhấn mạnh vai trò trung tâm của dữ liệu không có nghĩa là hạ thấp tầm quan trọng của các cấu phần khác.

Về mặt công nghệ, một hạ tầng số mạnh mẽ và an toàn đóng vai trò như hệ thần kinh số kết nối mọi chủ thể bên trong địa phương (như các bộ phận trong cơ thể con người). Hệ thống dữ liệu thống nhất cùng với các thuật toán phân tích dữ liệu hoặc AI giúp cho các chủ thể ở địa phương có thể xử lý kịp thời, chính xác các tình huống phát sinh.",,
Doanh nghiệp trong kỷ nguyên số cần dữ liệu có vai trò gì?,paraphased,,,"Trong kỷ nguyên số, các doanh nghiệp cần sử dụng dữ liệu để trở nên hiệu quả hơn thông qua kết nối và tương tác với bên ngoài cũng như quy trình tác nghiệp nội bộ. Dữ liệu này giúp họ tự điều chỉnh liên tục để thích nghi với những biến động của môi trường kinh doanh bên ngoài.",,
Có thể mô tả một ví dụ doanh nghiệp vừa và nhỏ chuyển đổi số không?,root,,"Ta sẽ xem xét một ví dụ có thật (nhưng không nêu tên). Một công ty trách nhiệm hữu hạn ở Hà Nội, theo xếp hạng thì thuộc nhóm doanh nghiệp quy mô vừa cả về số vốn và số lao động. Công ty hoạt động trong lĩnh vực nhà hàng ăn uống (F&B) và hiện đang sở hữu và vận hành một chuỗi 7 nhà hàng khá nổi tiếng ở Hà Nội. Đầu năm 2018 công ty quyết định hến hành chuyển đổi số, theo nhận thức lúc đó thì chỉ là triển khai ERP và trên thực tế là họ bắt đầu từ ERP.
Phân hệ đầu tiên được xem xét là hệ thống bán hàng. Thời điểm đó các nhà hàng trong công ty vẫn sử dụng nhân công đi ghi đon hàng thủ công tại từng bàn, chuyển hai liên đơn hàng cho thu ngân và bếp. Bếp chuẩn bị món theo đơn hàng còn thu ngân nhập đơn hàng vào máy tính để phục vụ thanh toán khi khách hàng yêu cầu. Tóm lại mặc dù đã có phần mềm quản lý bán hàng nhưng hệ thống vẫn hoạt động gần như thủ công và hiệu quà mang lại không đáng kể.
Lúc đó đã có rất nhiều nhà hàng ở Việt Nam có hệ thống ghi đơn hàng bằng máy tính bảng, trông có vẻ hiện đại và công ty bắt đầu bằng việc tìm hiểu các giải pháp như vậy. Hóa ra có rất nhiều giải pháp POS (Point of Sale) có sẵn trên thị trường và giá cả cũng khá khác nhau nhưng không đắt lắm. vấn đề là các giải pháp POS thường chú trọng vào việc quản lý bán hàng nhưng ít khi chú ý đến ERP chứ chưa nói gì đến chuyện tổng thể là chuyển đổi số hoạt động doanh nghiệp.
Sau khi nghiên cứu và thảo luận kỹ lưỡng, chiến lược được chọn là lên kế hoạch chuyển đổi số tổng thể rồi mới chọn ERP và triển khai lần lượt từng module theo lộ trình với yêu cầu triển khai đến đâu khai thác hiệu quả đến đó, tích lũy dữ liệu đi cùng với phân tích dữ liệu và ra các quyết định kinh doanh dựa trên dữ liệu.
Một nguyên tắc nữa được thống nhất là triển khai ERP đồng thời với thiết kế lại quy trình và tổ chức lại bộ máy công ty, một câu hỏi luôn được đặt ra trong các cuộc họp là ""đưa máy tính vào thì quy trình mới sẽ phải thế nào?"". Các module quản lý bán hàng, quản lý quan hệ khách hàng, chuôi cung ứng, quản lý phát triển món, quản lý tài chính, nguồn nhàn lực, quản lý tài sản... lần lượt được triển khai đã mang lại hiệu quả rất lớn về mặt nâng cao chất lượng dịch vụ, giảm thời gian chờ đợi của khách hàng, cắt giảm nhân lực quản lý đến 50%, giảm áp lực công việc lên cán bộ quản lý góp phần giải quyết bài toán thiếu hụt nhân lực khi phát triển các cơ sở mới.
Điều quan trọng là cùng với việc triển khai ERP công ty cũng đồng thời triển khai luôn các công cụ tự động hóa RPA và phân tích các dữ liệu thu được, tiến hành đổi mới mô hình kinh doanh, cơ cấu tổ chức cũng như quy trình kinh doanh, nghĩa là không phải triển khai xong ERP mới làm chuyển đổi số mà tiến hành đồng thời.
Lãnh đạo công ty cũng hiếu rằng chuyển đổi số là một quá trình liên tục, kế hoạch tiếp theo sẽ là nghiên cứu các công cụ phân tích kinh doanh sâu hơn, thử nghiệm các phương thức kinh doanh mới.","Một ví dụ về doanh nghiệp nhỏ và vừa đã thực hiện chuyển đổi số là công ty bán lẻ trực tuyến Zara. Bằng cách tận dụng các nền tảng thương mại điện tử, ứng dụng di động và phân tích dữ liệu khách hàng, Zara có thể cung cấp trải nghiệm mua sắm cá nhân hóa cho người tiêu dùng của mình, tăng cường sự tham gia với khách hàng và cải thiện hiệu quả hoạt động tổng thể.",,
Bạn có thể mô tả một ví dụ về doanh nghiệp vừa và nhỏ chuyển đổi số không?,paraphased,,,"Một ví dụ về doanh nghiệp nhỏ và vừa đã thực hiện chuyển đổi số là công ty sản xuất đồ nội thất Việt Nam, Ba Huy. Công ty này đã tích hợp các giải pháp công nghệ như phần mềm quản lý bán hàng, hệ thống tự động hóa quy trình kinh doanh và nền tảng thương mại điện tử để nâng cao hiệu quả hoạt động, cải thiện trải nghiệm khách hàng và mở rộng thị trường của mình. Nhờ đó, Ba Huy có thể tăng cường khả năng cạnh tranh trên thị trường nội thất trong nước và quốc tế.",,
Hãy cho một ví dụ về cách mà doanh nghiệp vừa và nhỏ chuyển đổi số?,paraphased,,,"Một ví dụ về cách mà các doanh nghiệp vừa và nhỏ (SME) có thể chuyển đổi số là thông qua việc triển khai hệ thống quản lý quan hệ khách hàng (CRM). Hệ thống CRM giúp SME theo dõi tương tác của họ với khách hàng, phân tích hành vi mua sắm của khách hàng và cá nhân hóa trải nghiệm cho từng người dùng. Bằng cách sử dụng công nghệ này, các doanh nghiệp có thể cải thiện sự hài lòng của khách hàng, tăng cường giữ chân khách hàng và cuối cùng là thúc đẩy lợi nhuận. Ngoài ra, hệ thống CRM cũng giúp SME hợp lý hóa quy trình kinh doanh, giảm chi phí vận hành và nâng cao hiệu quả tổng thể.",,
Ví dụ nào mô tả doanh nghiệp vừa và nhỏ thực hiện chuyển đổi số?,paraphased,,,"Một ví dụ về một doanh nghiệp nhỏ và vừa đang thực hiện chuyển đổi số là việc tích hợp công nghệ kỹ thuật số vào các sản phẩm, dịch vụ hiện có của họ và sáng tạo ra những sản phẩm mới. Họ cũng tập trung cải tiến mô hình kinh doanh cũ bằng cách nâng cao năng suất lao động, tiết kiệm chi phí sản xuất thông qua điều chỉnh cơ cấu tổ chức và quy trình kinh doanh trên nền tảng tích hợp công nghệ số. Ngoài ra, họ có thể thiết kế các hệ thống quản trị thông minh ngay từ đầu hoặc bổ sung phân hệ thu thập, xử lý dữ liệu hiện đại vào hệ thống ERP đang vận hành trơn tru để nâng cao chất lượng quyết định kinh doanh.",,
Kiến thức và kỹ năng số cơ bản trên môi trường thực - số là gì?,root,,"Khi cuộc sống đổi sang môi trường thực - số mỗi người đều cần những kiến thức và kỹ năng số cơ bản (digital literacy) để sử dụng máy tính, Internet, thiết bị số và điện thoại di động... Các kiến thức và kỹ năng số cơ bản thường được nhìn nhận và đề xuất nhiều ít khác nhau. Ở đây, chúng tôi giới thiệu những kiến thức và kỹ năng số cơ bàn dựa trên đề xuất của Microsoft bao gồm:
Sử dụng máy tính: Hiểu biết và có kỹ năng cơ bản về các thành phần của máy tính, hệ điều hành và những chức năng cơ bản, những loại ứng dụng chính có thể thực hiện với máy tính và sử dụng chúng thế nào.
Truy nhập thông tin trên mạng: Hiểu biết và có kỹ năng cơ bản về Internet và kết nối với Internet, cách khám phá World Wide Web bằng các trình duyệt web (web brovvser) và cách hoàn thành một số giao dịch trực tuyến một cách an toàn, cũng như các kiến thức cơ bản về tìm kiếm trên web bằng công cụ tìm kiếm web (search engine).
• Giao tiếp trực tuyến: Hiểu biết và có kỹ năng cơ bản về cách thiết lập và sử dụng email, cách giao tiếp với mọi người bằng tính năng nhắn tin, cuộc gọi thoại hay video.
Tham gia trực tuyến một cách an toàn, lịch sự và có trách nhiệm: Hiểu biết và có kỹ năng cơ bản về một số rủi ro về an toàn có thể ảnh hưởng đến mỗi người khi sử dụng Internet, các mẹo để giữ an toàn và giữ thông tin riêng tư trên mạng. Ngoài ra, cũng cần tìm hiểu thêm về quyền, các cách hay nhất để sử dụng thông tin trực tuyến và về sự đe dọa từ môi trường trực tuyến.
Tạo nội dung số: Hiểu biết và kỹ năng cơ bản về cách tạo tài liệu số ở dạng văn bản, chỉnh sửa, lưu và in văn bản.
Cộng tác và quản lý nội dung kỹ thuật số: Hiểu biết và có kỹ năng cơ bản về cách chia sẻ và cùng hợp tác làm việc trên tài liệu, cũng như cách quản lý thời gian, liên hệ và công việc với lịch số.
Kiến thức và kỹ năng số cơ bản có được qua huấn luyện hoặc tự học.","Kiến thức và kỹ năng số cơ bản trên môi trường thực-số bao gồm hiểu biết và có khả năng sử dụng máy tính, Internet, thiết bị số và điện thoại di động. Những kiến thức này thường được gọi là ""kiến thức và kỹ năng số cơ bản"" và chúng cho phép mỗi người tham gia vào các hoạt động trực tuyến khác nhau như truy nhập thông tin trên mạng, giao tiếp trực tuyến một cách an toàn, lịch sự và có trách nhiệm, tạo nội dung số, cộng tác và quản lý nội dung kỹ thuật số.",,
Những kiến thức và kỹ năng số cơ bản trên môi trường thực - số là gì?,paraphased,,,"Những kiến thức và kỹ năng số cơ bản trên môi trường thực-số bao gồm sử dụng máy tính, truy nhập thông tin trên mạng, giao tiếp trực tuyến, tham gia trực tuyến một cách an toàn, lịch sự và có trách nhiệm, tạo nội dung số, cộng tác và quản lý nội dung kỹ thuật số. Những kiến thức và kỹ năng này cho phép các cá nhân thực hiện hiệu quả công việc của mình trong môi trường số và tương tác với người khác trên mạng Internet.",,
Kiến thức và kỹ năng số cần thiết cho môi trường thực - số là gì?,paraphased,,,"Trong một doanh nghiệp số, để làm việc được trong một môi trường mới lạ như vậy mỗi người sẽ cần những kiến thức và kỹ năng mới mà cụ thể ở đây là kiến thức và kỹ năng liên quan đến công nghệ số. Mọi thành viên cần có hiểu biết về các công nghệ số mà doanh nghiệp sử dụng, hiểu biết về cách dữ liệu số được tạo ra và dòng chày dữ liệu trong doanh nghiệp, về ý thức cũng như cách thức bảo vệ dữ liệu đó như là tài sản trọng yếu của công ty.
        
        Trên một không gian sống mới lạ như vậy, điêu đầu tiên tự nhiên đến với mỗi người là phải có những kỹ năng số  để sống, dê tận hưởng những điều kỳ diệu về khả năng liên lạc và giao tiếp của con người trên môi trường thực-số. Đó là những kỹ năng cần nhất như dùng máy tính, như ""vào mạng"" thế nào, tìm kiếm thế nào những gì mình muốn biết... Đến những kỹ năng cao hơn như mua bán trên mạng, như tạo ra những nội dung số của riêng mình và chia sẻ với người khác. Sự trài nghiệm các kỹ năng số và kiến thức sẽ tạo ra năng lực số cơ bàn của mỗi người: truy nhập số, thương mại điện tứ, truyền thông số, dùng thiết bị điện tử, quy ước số, luật số, quyền hạn và bổn phận số, sức khoẻ số, và an toàn số.
        
        Điều vô cùng quan trọng là mỗi người trên môi trường thực-số phải an toàn, an toàn trong các giao dịch tài chính, an toàn trong các quan hệ xã hội, an toàn với dữ liệu riêng tư...",,
Các kỹ năng và kiến thức số cơ bản trong môi trường thực - số là gì?,paraphased,,,"Các kỹ năng và kiến thức số cơ bản trong môi trường thực-số bao gồm sử dụng máy tính, truy nhập thông tin trên mạng, giao tiếp trực tuyến, tham gia trực tuyến một cách an toàn, lịch sự và có trách nhiệm, tạo nội dung số, cộng tác và quản lý nội dung kỹ thuật số. Những kỹ năng này cho phép các cá nhân tương tác hiệu quả với môi trường thực-số và tận dụng lợi ích của chuyển đổi số trong cuộc sống hàng ngày cũng như công việc.",,
