question,type,paraphased_q_score,context,answer,answer_score,paraphased_q_answer_score
Những rủi ro nào có thể gặp phải khi phát triển chính phủ số?,paraphased,,,"1. Rủi ro về an toàn thông tin, an ninh mạng (bị tấn công, bị đánh cắp, bị sụp đổ hay gián đoạn).
2. Rủi ro quản trị dữ liệu và tính riêng tư.
3. Chất lượng có thể suy giảm ở bước đầu của sự thay đổi.
4. Rộng hơn, đối với người lao động đó còn là các rủi ro mất việc làm.
5. Không dám chấp nhận bất kỳ rủi ro nào trong quá trình chuyển đổi số.",,
Các rủi ro trong quá trình phát triển chính phủ số là gì?,paraphased,,,"1. Rủi ro về an toàn, an ninh mạng (bị tấn công, bị đánh cắp, bị sụp đổ hay gián đoạn).
2. Rủi ro về quản trị dữ liệu và tính riêng tư.
3. Rủi ro khi ở bước đầu của sự thay đổi chất lượng có thể suy giảm.
4. Rủi ro mất việc làm đối với người lao động.
5. Mất chủ quyền số quốc gia đối với Chính phủ.
6. Lộ lọt dữ liệu cá nhân, quyền riêng tư khi giao dịch với các dịch vụ chính phù số không bảo đảm an toàn, bảo mật.",,
Phát triển chính phủ số có thể gặp phải những rủi ro nào?,paraphased,,,"Phát triển Chính phủ số cũng có thể đối mặt với một số rủi ro như sau:
        1. Rủi ro về an toàn, an ninh mạng (bị tấn công, bị đánh cắp, bị sụp đổ hay gián đoạn).
2. Rủi ro về quản trị dữ liệu và tính riêng tư.
3. Rủi ro khi ở bước đầu của sự thay đổi chất lượng có thể suy giảm.
4. Rủi ro mất việc làm đối với người lao động do quá trình chuyển đổi số.
5. Rủi ro lớn nhất là không dám chấp nhận rủi ro nào trong thay đổi.
6. Mỗi tổ chức, mỗi doanh nghiệp cần phân tích để đánh giá những rủi ro mình có thể gặp phải và tìm cách khắc phục chúng.",,
Các cơ sở dữ liệu ưu tiên quốc gia là gì?,root,,"Theo Luật Công nghệ thông tin, cơ sở dữ liệu quốc gia là tập hợp thông tin của một hoặc một số lĩnh vực kinh tế - xã hội được xây dựng, cập nhật và duy trì đáp ứng yêu cầu truy nhập và sử dụng thông tin của các ngành kinh tế và phục vụ lợi ích xã hội. Hiện nay, hàng chục cơ sở dữ liệu quy mô quốc gia đã và đang được triển khai. Tuy nhiên, một số cơ sở dữ liệu quốc gia cần được ưu tiên, tập trung nguồn lực triển khai trước, tạo nên tảng cho triển khai chính phủ điện tử, chính phủ số.
Quyết định số 714/QĐ-TTg ngày 22/5/2015 của Thủ tướng Chính phủ ban hành danh mục cơ sở dữ liệu quốc gia cần ưu tiên triển khai tạo nền tảng phát triển chính phủ điện tử, đã xác định 6 cơ sở dữ liệu (CSDL) quốc gia cần được ưu tiên triển khai, tóm tắt như dưới đây.","6 cơ sở dữ liệu (CSDL) quốc gia cần được ưu tiên triển khai theo Quyết định số 714/QĐ-TTg ngày 22/5/2015 của Thủ tướng Chính phủ bao gồm: Cơ sở dữ liệu quốc gia về dân cư, Cơ sở dữ liệu đất đai quốc gia; Cơ sở dữ liệu quốc gia về đăng ký doanh nghiệp; Cơ sở dữ liệu quốc gia về tài chính; Cơ sở dữ liệu quốc gia về bảo hiểm xã hội; Cơ sở dữ liệu hộ tịch điện tử toàn quốc và Cơ sở dữ liệu quốc gia về y tế.",,
Những cơ sở dữ liệu được ưu tiên ở cấp quốc gia là gì?,paraphased,,,"6 cơ sở dữ liệu (CSDL) quốc gia cần được ưu tiên triển khai, đó là: Cơ sở dữ liệu quốc gia về dân cư, Cơ sở dữ liệu đất đai quốc gia; Cơ sở dữ liệu quốc gia về đăng ký doanh nghiệp; Cơ sở dữ liệu quốc gia về tài chính; Cơ sở dữ liệu quốc gia về bảo hiểm; Cơ sở dữ liệu hộ tịch điện tử toàn quốc; Cơ sở dữ liệu quốc gia về y tế.",,
Các cơ sở dữ liệu quan trọng quốc gia là gì?,paraphased,,,"1. Cơ sở dữ liệu quốc gia về dân cư;
2. Cơ sở dữ liệu đất đai quốc gia;
3. Cơ sở dữ liệu quốc gia về đăng ký doanh nghiệp;
4. Cơ sở dữ liệu quốc gia về tài chính;
5. Cơ sở dữ liệu quốc gia về bảo hiểm xã hội;
6. Cơ sở dữ liệu hộ tịch điện tử toàn quốc;
7. Cơ sở dữ liệu quốc gia về y tế;
8. Cơ sở dữ liệu quốc gia về giáo dục (đang xây dựng).",,
Cơ sở dữ liệu nào được ưu tiên hàng đầu ở cấp quốc gia?,paraphased,,,"6 cơ sở dữ liệu (CSDL) quốc gia cần được ưu tiên triển khai, đó là: Cơ sở dữ liệu quốc gia về dân cư, Cơ sở dữ liệu đất đai quốc gia; Cơ sở dữ liệu quốc gia về đăng ký doanh nghiệp; Cơ sở dữ liệu quốc gia về tài chính; Cơ sở dữ liệu quốc gia về bảo hiểm; Cơ sở dữ liệu hộ tịch điện tử toàn quốc; Cơ sở dữ liệu quốc gia về y tế.",,
Số hóa văn bản hành chính và khai thác thế nào?,root,,"Cho đến nay, các loại văn bàn hành chính ở các co quan của Đảng, Chính phủ và Quốc hội, các bộ ngành và các địa phương vẫn ở dạng giấy hoặc dạng điện tử pdf. Tất nhiên văn bàn ở dạng này của Chính phủ/chính quyền điện tử và với khối lượng hàng triệu văn bản hành chính đang ngày càng nhiều thêm, việc khai thác và sử dụng rất khó khăn và thiếu hiệu quả.
Hiện nay các văn bản hành chính tại các cổng thông tin điện tử hầu hết ở dạng pdf ảnh và kèm theo một đoạn trích yếu ngắn mô tả văn bản. Việc tìm kiếm văn bản được thực hiện trên trích yếu cùng các siêu dữ liệu (metadata). Khi tìm ra một văn bản, người dùng phải bỏ thời gian tải về để đọc. Trong các hệ thống như vậy hiện nay, với mỗi việc cần xử lý và quyết định ở các cơ quan nhà nước, hầu như không ai có thể biết và tìm ra được hết các văn bản liên quan. Người dân hay doanh nghiệp khi có việc, cũng không thể biết nhà nước hay địa phương đã ban hành những luật lệ, quy định gì mình phải theo.
Phẩn ba: Chính phủ số
Việc số hóa và các công nghệ tiên tiến của học máy và AI, cụ thể của lĩnh vực khai phá văn bản (text mining), xử lý ngôn ngữ tự nhiên (NLP) và dữ liệu lớn (big data) đã cho phép tự động hóa gán nhãn các văn bản sau số hóa, kết nối văn bản về nội dung và tìm kiếm văn bản theo nội dung, đáp ứng nhiều nhu cầu sử dụng văn bản hành chính của người dùng. Nền tảng cho công việc này đã được phát triển và sử dụng ở Việt Nam.","Việc số hóa và khai thác các văn bản hành chính có thể được thực hiện thông qua việc sử dụng công nghệ tiên tiến như học máy, xử lý ngôn ngữ tự nhiên và dữ liệu lớn. Các công nghệ này cho phép gán nhãn tự động các văn bản sau khi đã được số hóa, kết nối chúng về nội dung và tìm kiếm theo nội dung, đáp ứng nhu cầu đa dạng của người dùng trong việc sử dụng văn bản hành chính. Nền tảng cho công việc này đã được phát triển và sử dụng ở Việt Nam.
        
        Tuy nhiên, cần có một kế hoạch chuyển đổi số phù hợp với tổ chức để xác định những yếu tố dẫn dắt quá trình số hóa. Kế hoạch nên kết nối cấp độ số hóa với cấp độ khai thác cơ hội số khi lập kế hoạch. Cần nắm bắt mô hình và quy trình hoạt động sử dụng chuẩn dữ liệu gì và thế nào trong cách làm việc mới khi lập kế hoạch chuyển đổi số. Mô hình và quy trình có thể thay đổi, do đó kế hoạch cũng cần điều chỉnh theo.
        
        Ngoài ra, tổ chức nên xem xét những câu hỏi cụ thể như các quy trình nghiệp vụ hoặc thủ tục hành chính đã được tin học hóa và sẽ chuyên sang môi trường thực-số là gì? Thông tin về mức độ số hóa hiện tại và tương lai của dữ liệu cần làm nhưng chưa được làm là gì? Dữ liệu số hóa sẽ được sử dụng như thế nào, những gì khác nên được số hóa thêm vào, khi nào thì nên làm điều đó, khó khăn trong quá trình chuyển đổi số là gì, tự động hóa ở mức độ nào và tiêu chuẩn chất lượng của dữ liệu số hóa ra sao.",,
Làm thế nào để số hóa văn bản hành chính và khai thác?,paraphased,,,"Số hóa văn bản hành chính có thể được thực hiện thông qua các công nghệ tiên tiến như học máy, AI, xử lý ngôn ngữ tự nhiên (NLP) và dữ liệu lớn. Các công nghệ này cho phép tự động hóa gán nhãn các văn bản sau số hóa, kết nối văn bản về nội dung và tìm kiếm văn bản theo nội dung, đáp ứng nhiều nhu cầu sử dụng văn bản hành chính của người dùng. Nền tảng cho công việc này đã được phát triển và sử dụng ở Việt Nam.",,
Phương pháp số hóa và khai thác văn bản hành chính như thế nào?,paraphased,,,"Phương pháp số hóa và khai thác văn bản hành chính bao gồm việc chuyển đổi các tài liệu giấy hoặc dạng pdf sang định dạng kỹ thuật số, sau đó sử dụng công nghệ tiên tiến của học máy và AI để tự động gán nhãn cho các văn bản đã được số hóa. Quá trình này giúp kết nối các văn bản về nội dung và tìm kiếm theo nội dung, đáp ứng nhiều nhu cầu sử dụng khác nhau của người dùng.

Ngoài ra, việc khai thác dữ liệu lớn (big data) và xử lý ngôn ngữ tự nhiên (NLP) cũng đóng vai trò quan trọng trong quá trình này. Các công nghệ tiên tiến này cho phép phân tích văn bản hành chính một cách hiệu quả hơn, giúp các cơ quan nhà nước dễ dàng tìm kiếm và truy cập thông tin cần thiết để đưa ra quyết định nhanh chóng và hiệu quả hơn.

Hơn nữa, việc số hóa cũng tạo điều kiện thuận lợi cho người dân và doanh nghiệp tiếp cận với luật lệ, quy định mà họ phải tuân thủ một cách dễ dàng hơn. Điều này góp phần vào quá trình chuyển đổi số tổng thể của các cơ quan nhà nước và thúc đẩy sự phát triển của chính phủ điện tử.",,
Cách thức số hóa và khai thác văn bản hành chính là gì?,paraphased,,,"Số hóa và khai thác văn bản hành chính có thể được thực hiện thông qua các công nghệ tiên tiến như học máy, AI, xử lý ngôn ngữ tự nhiên (NLP) và dữ liệu lớn. Các công nghệ này cho phép gán nhãn tự động các văn bản sau số hóa, kết nối chúng về nội dung và tìm kiếm theo nội dung, đáp ứng nhiều nhu cầu sử dụng khác nhau của người dùng. Nền tảng cho việc này đã được phát triển và sử dụng ở Việt Nam.",,
Chuyển đổi số trong lĩnh vực nông nghiệp có thể như thế nào?,root,,"Đặc điểm chủ yếu của sản xuất nông nghiệp là hầu hết sản phẩm phải dùng trong thời gian ngắn hạn hoặc phải được chế biến.
Theo chúng tôi, hai hướng chính của chuyển đổi số nông nghiệp trên môi trường thực-số là quản lý nông nghiệp số và sản xuất nông nghiệp thông minh.
1) Quản lý nông nghiệp số: Trong thời đại số, việc quản lý số mọi hoạt động đều dựa trên dữ liệu. Việc đầu tiên cần đột phá là xây dựng CSDL nông nghiệp quốc gia. CSDL này phải khác các CSDL đã làm trước đây qua các cuộc tổng điều tra nông thôn, nông nghiệp và thủy sân. Chú ý đây phải là một CSDL động, với dữ liệu được cập nhật thường xuyên, từ cấp xã lên huyện lên tỉnh lên Bộ.
Một CSDL như vậy nếu xét ở thời điểm 10 năm trước sẽ không thể làm được, nhưng với các công nghệ số hiện nay, đây là điều hoàn toàn có thể. Khi phân tích CSLD nông nghiệp quốc gia này, cùng các CSDL thu thập về thị trường cũng như dự báo sản xuất trong và ngoài nước, chắc chắn việc xác định cung - cầu một cách địnhlượng sẽ là một bước tiến vượt bậc của quản lý sản xuất nông nghiệp. Chẳng hạn như khi đó, người quản lý có thể dễ dàng trả lời các câu hỏi như vào đầu tháng 12 năm nay cả nước có bao nhiêu tấn thịt lợn.
Khi có dữ liệu đủ tốt, có thể giải các bài toán macro về tối ưu trong sản xuất nông nghiệp.
2) Sán xuất nông nghiệp thông minh: Đây là câu chuyện lâu nay đã được đề cập đến trong sản xuất nông.
 Đó là các trang trại thông minh, là chăn nuôi thông minh, là trồng trọt thủy canh... nơi dữ liệu được đo đạc, lưu trữ và phân tích... và từ đó năng suất lao động được tăng lên.","Chuyển đổi số trong lĩnh vực nông nghiệp có thể bao gồm việc sử dụng công nghệ số, các hạ tầng số kết nối hàng ngang và kết nối hàng dọc để giải quyết những vấn đề của nền kinh tế nông nghiệp truyền thống. Điều này sẽ giúp chuyển từ một nền nông nghiệp sản xuất hàng hóa sang một nền kinh tế nông nghiệp thông minh hơn, hiệu quả hơn và có khả năng thích ứng cao hơn. Chuyển đổi số trong lĩnh vực nông nghiệp là phương thức quan trọng để đạt được mục tiêu này.
        
        Theo Quyết định 749/QĐ-TTg của Thủ tướng Chính phủ về Chương trình chuyển đổi số quốc gia, chuyển đổi số trong lĩnh vực nông nghiệp cũng nằm trong danh sách các lĩnh vực ưu tiên cần thực hiện chuyển đổi số trước. Chiến lược chuyển đổi số cho lĩnh vực này sẽ do tư lệnh của ngành (Bộ Nông nghiệp và Phát triển Nông thôn) xây dựng và quyết định dựa trên nguyên lý của chuyển đổi số.
        
        Để đạt được mục tiêu chuyển đổi số trong nông nghiệp, những người hoạt động trong lĩnh vực và cán bộ của Bộ Nông nghiệp và Phát triển Nông thôn cần có năng lực số ở mức độ nhất định. Văn hóa đổi mới sáng tạo của ngành trên môi trường thực-số cũng nên được phát huy để thúc đẩy quá trình chuyển đổi này. Tuy nhiên, việc giải quyết các vướng mắc và rào cản về thể chế hiện tại là rất quan trọng. Nếu lĩnh vực nông nghiệp làm chuyển đổi số sẽ gặp phải những vướng mắc và rào cản pháp lý của hệ thống pháp luật hiện hành thì cần thay đổi khung pháp lý và quy định nội bộ để khắc phục chúng.",,
Chuyển đổi số trong ngành nông nghiệp có thể phát triển như thế nào?,paraphased,,,"Chuyển đổi số trong ngành nông nghiệp có thể được phát triển thông qua việc sử dụng các công nghệ số, kết nối ngang và dọc để giải quyết những vấn đề quy mô quốc gia cũng như địa phương. Điều này sẽ giúp chuyển từ nền nông nghiệp sản xuất hàng hóa sang một nền kinh tế nông nghiệp thông minh hơn, hiệu quả hơn và có khả năng thích ứng cao hơn. Một trong những cách thức là phát triển các nền tảng dựa trên công nghệ số hiện đại để thay đổi sản xuất nông nghiệp, giải quyết bài toán tối ưu trong sản xuất và tiêu thụ sản phẩm nông nghiệp hoặc sử dụng công nghệ để làm du lịch tốt hơn. Chuyển đổi số ở mọi cơ quan chính quyền, mọi lĩnh vực kinh tế sẽ đưa Việt Nam đến một tương lai mới.",,
Lĩnh vực nông nghiệp có thể ứng dụng chuyển đổi số ra sao?,paraphased,,,"Chuyển đổi số trong lĩnh vực nông nghiệp là một phương thức quan trọng để chuyên từ nền nông nghiệp sàn xuất hàng hoá sang một nên kinh tế nông nghiệp thông minh hơn, hiệu quả hơn và có khà năng thích úng cao hơn. Để xây dựng một nền kinh tế nông nghiệp thống minh nhất thiết phải sử dụng công nghệ số, sử dụng các hên tàng số kết nối hàng ngang, kết nối hàng dọc dế giải quyết những vấn đề này cá ó quy mô quốc gia cũng như quy mô địa phương.
        
        Chuyển đổi số trong lĩnh vực nông nghiệp có thể ứng dụng thông qua việc xây dựng cơ sở dữ liệu lớn về đất đai và cây trồng; sử dụng các công nghệ tiên tiến để dự báo, cảnh báo thời tiết, sâu bệnh hại; phát triển hệ thống tưới tiêu tự động dựa trên điều kiện thực tế của đồng ruộng; áp dụng kỹ thuật canh tác chính xác bằng cảm biến thông minh và phân tích dữ liệu theo thời gian thực. Ngoài ra, chuyển đổi số trong lĩnh vực nông nghiệp cũng có thể giúp người dân tiếp cận các nguồn lực tài chính, thị trường một cách hiệu quả hơn thông qua nền tảng trực tuyến.
        
        Chuyển đổi số liên quan đến nhiều lĩnh vực chuyên sâu về thị trường, về công nghệ, về pháp lý... Các chuyên gia chuyển đổi số có hiểu biết chung về chuyển đổi số và các công nghệ số liên quan, có hiếu biết chung về kinh tế, xã hội, pháp lý... đế giúp các tổ chức, doanh nghiệp xây dựng lộ trình chung.",,
Áp dụng chuyển đổi số trong nông nghiệp có thể như thế nào?,paraphased,,,"Chuyển đổi số trong nông nghiệp là việc sử dụng công nghệ số để kết nối hàng ngang, kết nối hàng dọc nhằm giải quyết các vấn đề về cung cầu không gặp nhau. Điều này giúp chuyển từ nền nông nghiệp sản xuất hàng hóa sang một nền kinh tế nông nghiệp thông minh hơn, hiệu quả và có khả năng thích ứng cao hơn. Chuyển đổi số ở địa phương là việc chung của tất cả chủ thể, bao gồm người dân và doanh nghiệp, trước hết bằng cách tự chuyển đổi số chính mình. Một kiểu kết nối khác trong nông nghiệp là kết nối theo chuỗi giá trị (kết nối hàng dọc) giúp tổ chức lại cho hiệu quả hơn. Thông tin dự báo về nhu cầu cho từng loại cây con cụ thể không có hoặc nếu có cũng không tiếp cận được những hộ nông dân trực tiếp sản xuất, dẫn đến cung-cầu không gặp nhau.",,
Khi nào phải phát triển chính phủ số?,root,,"Ngay bây giờ. Hành động nhanh thì có lợi thế. Hành động chậm thì lỡ thời cơ, khó thu hút nguồn lực.
Chính phủ SỐ trở thành xu hướng tất yếu, không thể đảo ngược mà mỗi nước phải thúc đẩy, nếu không sẽ ngày càng bị bỏ xa, tụt hậu. Năm 2020 là lần đầu tiên thuật ngữ chính phủ số được Liên họp quốc sử dụng làm chủ đề của Báo cáo khảo sát xếp hạng mức độ phát triển Chính phủ điện tử, chủ đề năm 2020 là ""Chính phủ số trong một thập kỷ hành động vì sự phát triển bền vững"".
Chính phủ số phải đóng vai trò nền tảng, điều kiện cho phát triển kinh tế số, xã hội số trong chuyển đổi số, vì vậy phải được triển khai càng sớm càng tốt. Quan trọng nhất là phải có nhận thức đúng về tầm quan trọng và tính cấp thiết về chuyển đổi số, chính phủ số. Một cơ quan, tổ chức có thể tiến hành chuyển đổi số ngay thông qua việc sử dụng nguồn lực, hệ thống kỹ thuật sẵn có để số hóa tài sản thông tin của mình, tái cấu trúc quy trình nghiệp vụ, cơ cấu tổ chức và chuyển đổi các mối quan hệ từ môi trường truyền thống sang môi trường thực-số.
Chiến lược phát triển Chính phủ số được
Thủ tướng Chính phủ phê duyệt trong
Quyết định số 942/QĐ-TTg xác định rõ các mục tiêu, nhiệm vụ, giải pháp cần thực hiện với các mốc thời gian cụ thể.","Chính phủ số phải được triển khai càng sớm càng tốt để đóng vai trò nền tảng, điều kiện cho phát triển kinh tế số, xã hội số trong chuyển đổi số. Quan trọng nhất là phải có nhận thức đúng về tầm quan trọng và tính cấp thiết về chuyển đổi số, chính phủ số.",,
Thời điểm nào cần phát triển chính phủ số?,paraphased,,,"Chính phủ số phải đóng vai trò nền tảng, điều kiện cho phát triển kinh tế số, xã hội số trong chuyển đổi số, vì vậy phải được triển khai càng sớm càng tốt. Quan trọng nhất là phải có nhận thức đúng về tầm quan trọng và tính cấp thiết về chuyển đổi số, chính phủ số. Một cơ quan, tổ chức có thể tiến hành chuyển đổi số ngay thông qua việc sử dụng nguồn lực, hệ thống kỹ thuật sẵn có để số hóa tài sản thông tin của mình, tái cấu trúc quy trình nghiệp vụ, cơ cấu tổ chức và chuyển đổi các mối quan hệ từ môi trường truyền thống sang môi trường thực-số.",,
Khi nào là lúc nên phát triển chính phủ số?,paraphased,,,2021-2025,,
Phải phát triển chính phủ số vào thời gian nào?,paraphased,,,"Chính phủ số phải được triển khai càng sớm càng tốt để đóng vai trò nền tảng, điều kiện cho phát triển kinh tế số, xã hội số trong chuyển đổi số. Quan trọng nhất là phải có nhận thức đúng về tầm quan trọng và tính cấp thiết về chuyển đổi số, chính phủ số.",,
