question,type,paraphased_q_score,context,answer,answer_score,paraphased_q_answer_score
Kinh tế số là gì ?,root,,"Xây dựng nền kinh tế số hay là chuyển đổi số kinh tế trước hết là câu chuyện của cộng đồng doanh nghiệp và mồi người dân. Khi một doanh nghiệp tiến hành chuyển đổi số, doanh nghiệp đó thường ít quan tâm mình có thuộc kinh tế số  hay không hoặc mình được phân loại vào nhóm nào trong các nhánh của kinh tế số. Tuy vậy, để thúc đây chuyển đổi số, quán trị nền kinh tế quốc gia và hội nhập quốc tể cân có các định nghĩa có thế khái quát được các khía cạnh đa dạng của kinh tế số .
Có nhiêu định nghĩa khác nhau về kinh tế số do xuất phát từ nhiều cách nhìn khác nhau. Một là cách nhìn gắn với mô hình sàn xuất mới, tập trung vào việc sử dụng công nghệ số  của nhà sàn xuất, dẫn đến một định nghĩa dựa trên nhu câu đo được mức sử dụng và đâu tư vào các sản phẩm liên quan đến công nghệ thống tin và truyền thông (ict). Hai là cách nhìn theo kinh tế vĩ mô về giá trị gia tăng và thu nhập tạo ra bởi kinh tế số  dẫn đến một định nghĩa dựa trên các ngành công nghiệp truyền thống. Ba là cách nhìn gắn với các đột phá số  trong chuỗi giá trị dẫn đến một định nghĩa tập trung vào bán chất của giao dịch, tức là liệu sản phẩm có được đặt hàng trên mạng (đặt hàng số) và/hoặc giao hàng trên mạng (giao hàng số) hay không. Bốn là cách nhìn tập trung vào đột phá số  trong hành vi của các hộ gia đình (ví dụ về mặt hàng tiêu dùng và sản xuất), tập trung vào các khía cạnh phi tiền tệ của kinh tế số và dẫn đến một định nghĩa vượt ra khỏi ranh giới sản xuất quốc gia. Do đó, vấn đề quan trọng là phải đưa ra được một định nghĩa dung hòa được các quan điểm khác nhau, dựa vào mức độ tham gia vào kinh tế số của các sản phẩm và tác nhân.
Có hai cách tiếp cận thường được sử dụng để định nghĩa kinh tế số. Cách thứ nhất, tiếp cận từ dưới lên, mô tả đặc điểm của các ngành công nghiệp và quy trình sàn xuất hoặc sàn lượng của các công ty để quyết định chúng có thể ’được xem là kinh tế số hay không. Cách thứ hai, tiếp cận từ trên xuống, dựa trên các yếu tố thúc đẩy chuyển đổi số để phân tích mức độ ảnh hưởng của chúng vào nền kinh tế truyền thống. Mặc dù các biến thế của hai cách tiếp cận này đã được đề xuất bời nhiều tổ chức quốc tế, cơ quan thống kê quốc gia, học già và khu vực tư nhân, nhưng không có phương pháp nào có thể nắm bắt đầy đủ tất cả các khía cạnh và quan diêm của kinh tế số. Đã có những nỗ lực đề xuất các định nghĩa theo từng cấp độ khác nhau của kinh tế số nhằm giải quyết các khía cạnh và quan điểm khác nhau.
Một định nghĩa linh hoạt về kinh tế số đạt được những ưu điểm chính của hai loại định nghĩa dưới lên và trên xuống đề xuất trong nghiên cứu của bukht và heeks, phân biệt giữa việc sử dụng rộng rãi và sử dụng tăng cường các công nghệ số để định ra các vùng của kinh tê số.
Theo định nghĩa này kinh tế số gồm ba vùng của các hoạt động:
Vùng lõi kinh tế số gồm các hoạt động kinh tế trong lĩnh vực cntt- tt, tạo ra hàng hoá và dịch vụ số (tiêu biếu là sản xuất phần cứng, phần mềm và tư vân cntt, dịch vụ thông tin, và truyền thông).
Vùng hẹp kinh tế số bao gồm vùng lõi và các hoạt động kinh tế chi có được hoặc chủ yếu có được nhờ dựa vào các công nghệ số, tiêu biểu là mô hình kinh doanh của dịch vụ số và kinh tế nền tảng.
Vùng rộng kinh tế số bao gồm vùng hẹp và các hoạt động kinh tế có dùng công nghệ số để nâng cao năng suất lao động. Các loại hình kinh tế chia sẻ hay kinh tế việc làm tự do được xem là nằm ở giữa vùng rộng và hẹp.
Tô đặc nhiệm detf (digital economy task force) về kinh tế số của nhóm g20 quan niệm về kinh tế số ""đề cập tới dải rộng các hoạt động kinh tế sử dụng thông tin và tri thức với số hoá làm yếu tố chính của sản xuất, sử dụng mạng thông tin hiện đại như một không gian hoạt động quan trọng, và sử dụng hiệu quả công nghệ thống tin và truyền thông (ict) như một động lực quan trọng để tăng năng suất và tối ưu hoá cơ cấu kinh tế"". Quan niệm này cũng nhấn mạnh các đặc điểm hệ thống, dữ liệu và kết nối như trong hai nguyên lý của phương pháp luận st-235. Dữ liệu chính là ""nguyên liệu đầu vào"" để tạo ra thông tin và tri thức với các phương pháp của trí tuệ nhân tạo và khoa học dữ liệu, ""không gian hoạt động quan trọng"" chính là hệ thống kết nối thực-số của mỗi chủ thể trên đó các hoạt động kinh tế sử dụng các công nghệ số.
Với mục tiêu tiến tới một định nghĩa đồng thuận và có thể đo lường hoạt động kinh tế số, gân đây tổ đặc nhiệm detf đưa ra định nghĩa: ""kinh tế số bao gồm tất cả các hoạt động kinh tế dựa trên đầu vào số hoặc được cài thiện đáng kể khi sử dụng đầu vào số, bao gồm công nghệ số, hạ tầng số, dịch vụ số và dữ liệu. Kinh tế số đề cập đến tất cả các nhà sản xuất và người tiêu dùng, bao gồm cả chính phủ, đang sử dụng các đầu vào số trong các hoạt động kinh tế."".
Có thể xem định nghĩa mới của detf là một mở rộng mô hình của bukht và heeks ở hai điểm. Điểm mở rộng thứ nhất là quan niệm ""đầu vào số"" với nhìn nhận rộng rãi, gôm các công nghệ số, hạ tầng số, dịch vụ số và dữ liệu, và xác định các vùng của kinh tế số:
Vùng lõi = ""hoạt động kinh tế từ các nhà sản xuất tạo ra sản phẩm cntt-tt và dịch vụ số"".
Vùng hẹp = vùng lõi + ""hoạt động kinh tế dựa trên đầu vào số"".
Vùng rộng = vùng hẹp + ""hoạt động kinh tế được cải thiện đáng kể với đầu vào số"".
Đầu vào số = công nghệ số + hạ tầng số + dịch vụ số + dữ liệu.
Điểm mở rộng thứ hai là xem xét trong kinh tế số các hoạt động vốn không được xem là hoạt động kinh tế. Kinh tế số ngày càng có các tác động xã hội rộng lớn hơn và đã vượt ra ngoài các hoạt động chính thức được ghi vào thống kê kinh tế. Để giải quyết vấn đề này cho các hoạch định chính sách, định nghĩa tổng thể được đề xuất ở trên đã được detf kết hợp với một khung định nghĩa theo tùng vùng để không chỉ hỗ trợ việc đo lường và khả năng đánh giá kinh tế số bởi các thống kê kinh tế nhưng cũng để cho phép tính cả các hoạt động số hoá hiện không được xem như các hoạt động kinh tế. Định nghĩa toàn diện này, bao gồm các vùng khác nhau, cung cấp cho các thành viên g20 một khuôn khổ nhất quán và đồng thuận để hướng dẫn hoạch định các vùng khác nhau của kinh tế số:
Vùng lõi của kinh tế số chỉ bao gôm hoạt động kinh tế của các nhà sàn xuất nội dung số, hàng hoá và dịch vụ cntt-tt.
Vùng hẹp gồm vùng lõi cùng các hoạt động kinh tế dựa trên đầu vào số của các nhà sản xuất.
Vùng rộng gôm hai vùng lõi và hẹp cùng các hoạt động kinh tế dược cải thiện đáng kể nhờ sử dụng đầu vào số của các nhà sản xuất.
Xã hội số được mở rộng hơn khi kết hợp các tương tác và hoạt động được sớ hoá, vốn không phải các sản xuất đóng góp vào gdp, chẳng hạn như các hoạt động sử dụng các nền tảng số miễn phí (gồm cả các nền tâng số công cộng). Mặc dù không được coi là một phần của kinh tế sớ, nhưng hoạt động này rất quan trọng đối với chính sách của chính phủ.
Hoạt động kinh tế bô’ sung- đặt hàng số và/hoặc giao hàng sớm có thể được coi là một phần của kinh tế số, được phân định dựa trên bản chất của giao dịch thay vì dựa trên sản phẩm hoặc phương pháp sàn xuất của các nhà sản xuất. Các hoạt động này tập trung vào phương thức đặt hàng hoặc giao hàng, không phụ thuộc vào sản phẩm cuối cùng hoặc sản phẩm được sàn xuất như thế nào.
Một ví dụ của kinh tế số ó vùng hẹp là hoạt động của tổng công ty dầu khí biến đông (bien dong poc). Việc tối ưu hoá chi phí thăm dò, khai thác và tập trung nghiên cứu các giãi pháp để tăng cường tối đa lượng dầu khí thu hồi trong mò, nâng cao hiệu quả khai thác là mục tiêu, nhiệm vụ hàng đầu đối với công ty. Do đó, các cảm biến và các van điều khiến trong môi trường vỉa chứa và hệ thống xử lý khí ngưng tụ phức tạp phải được số hoá, được kết nối, được giám sát và xử lý trong thời gian thực. Từ đó bien dong poc đã phân tích hiện trạng hệ thống công nghệ, đưa ra các quyết định tối ưu, áp dụng khoa học dữ liệu, công nghệ tự động hoá nâng cao vào toàn bộ hệ thống quản trị, vận hành và sàn xuất mò khí.
Công ty rạng đông là một ví dụ về nỗ lực chuyển đổi số ở vùng rộng của kinh tế số. Hoạt động trong lĩnh vực chiếu sáng, trong lúc thị trường có những cạnh tranh quyết liệt về công nghệ chiếu sáng thế hệ thứ tư- công nghệ led. Rạng đông đã xác định phải trở thành một doanh nghiệp thông minh, tức một doanh nghiệp thực-số với mô hình hoạt động thông minh, linh hoạt và thích ứng với biến đổi của môi trường. Rạng đông bắt đầu tiến hành chuyển đổi số từ năm 2020 một cách tổng thể , toàn diện, đồng bộ cả trước và trong sản xuất với đột phá là tái cấu trúc chiến lược sản phẩm-dịch vụ và tái cấu trúc mô hình kinh doanh. Điều đáng kể là tinh thân và hoạt động chuyển đổi số đã được lãnh đạo của rạng đông truyền đến tất cả nhân viên công ty và năm 2021 doanh thu và lợi nhuận của công ty đã tăng đáng kể so với năm trước (16% và 18,4% tương ứng).
Khi nhìn kinh tế số theo st-235 cần thấy cơ cấu nền kinh tế phải được tái cấu trúc theo hướng tạo ra ""sản phẩm-dịch vụ"" thông minh phù hợp với các xu hướng của cuộc cách mạng công nghiệp lần thứ tư. Đó là công nghiệp công nghệ thống tin với sản xuất nội dung số, các dịch vụ và hàng hoá công nghệ thống tin-truyền thông (vùng lõi), đẩy mạnh các lĩnh vực kinh tế dựa trên đầu vào số, chẳng hạn các sản phẩm ""thông minh"" nhờ tích họp lot, ai, các mô hình kinh tế nền tảng... (vùng hẹp), và đặc biệt thúc đẩy mọi hoạt động kinh tế sử dụng đầu vào số để gia tăng hiệu quả (vùng rộng) và xem đây là vùng đột phá của kinh tế số.
Bên cạnh việc chuyên dịch co cấu kinh tế theo hướng tăng tỷ trọng kinh tế số vùng hẹp và vùng rộng, một nội dung quan trọng của việc phát triển kinh tế số là chuyển đổi số nhằm nâng cao hiệu quả của các lĩnh vực kinh tế truyền thống. Một mặt trong thế giói thực- số đang hình thành nền kinh tế thực vân phải là chủ dạo, đáp ứng các nhu cầu vật chất và tinh thần của con người. Mặt khác các lĩnh vực kinh tế truyền thống liên quan đến công việc và cuộc sống của đại đa số dân cư và việc nâng cao hiệu quả hoạt động của khu vực này có vai trò quyết định trong đám bào an sinh xã hội. Việc khuyến khích phát triển các mô hình kinh tế mới như kinh tế chia sẻ, kinh tế tuần hoàn, kinh tế lao động tự do (gig economy), kinh tế bao trùm sẽ góp phần làm cho nền kinh tế xanh hon và hiệu quả hơn.
Với các đích đến của kinh tế số kế trên, quy trình vận hành của các tổ chức kinh tế thực chất là chuyển đổi số chính mình với những mô hình kinh doanh mới, với việc tích cực dùng các công nghệ số một cách phù hợp và đặc biệt dùng dữ liệu và kết nối trong ""quy trình vận hành"" cũng như trong ""quản trị-quân lý"". Ngoài việc thúc đẩy, hỗ trợ từng doanh nghiệp chuyển đổi số thành công, việc xây dựng kết nối và tô chức việc chia sẻ, dùng chung dữ liệu (có phí hoặc miễn phí) trong cộng đồng doanh nghiệp, kết nối và chia sẻ dữ liệu với chính quyền số và với người dân có vai trò quan trọng để xây dựng một rìên kinh tế số quốc gia hiệu quả. Các nền tảng số tin cậy và an toàn ở quy mô quốc gia cho phép các doanh nghiệp kết nối theo chiều dọc của chuỗi giá trị cũng như theo chiều ngang giữa các doanh nghiệp cùng ngành nghề sẽ là chất keo gắn kết các doanh nghiệp thành các hệ sinh thái kinh tế số hiệu quả.
Cũng như đối với các hệ thực-số khác, nền kinh tế số đòi hỏi các biện pháp an ninh-an toàn đủ mạnh để chống lại các nguy cơ phát sinh. Việc bổ sung và mỡ rộng kết nối số bên cạnh các phương thức kết nối truyền thống trong thế giới thực mang lại hiệu quả to lớn nhưng cũng tạo ra thêm các thách thức an ninh-an toàn mới và cân có các biện pháp bảo vệ thích hợp cả ở mức từng doanh nghiệp cũng như ở tầm quốc gia.
Nền kinh tế số hiến nhiên đòi hỏi phải có nguồn nhân lực số, thể chế kinh tế phù hợp và một hạ tầng công nghệ số mạnh. Ba họp phân của hệ sinh thái thực-số là con người, thể chế và công nghệ là các yếu tố quyết định thành bại của việc chuyển đổi số nói chung và chuyển đổi số kinh tế nói riêng.
Về yếu tố con người, ngoài năng lực chuyên môn truyền thống mỗi người lao động cân được trang bị các năng lực số cân thiết bao gồm các thành phần nhận thức về sự thay đổi đang diên ra trong thị trường lao động, các kiến thức và kỹ năng làm chủ công nghệ số liên quan và yếu tố văn hoá trong môi trường làm việc mới. Dưới tác động của cuộc cách mạng công nghiệp lần thứ tư, các ngành nghề truyền thống đang biến đổi sâu sắc, nhiều nghề nghiệp sẽ bị mất đi, nhiều nghề nghiệp mới đang và sẽ xuất hiện. Việc chủ động đi trước, đón đầu trong chuẩn bị nguồn nhân lực phù hợp cho bối cảnh mới sẽ quyết định thành bại của sự nghiệp chuyển đổi số quốc gia.
Thể chế kinh tế hiện hành được xây dựng và từng bước hoàn thiện để phù hợp với mô hình kinh tế hiện tại. Khi xây dựng kinh tế số, cần chủ động sửa đổi, mở rộng thể chế kinh tế để bao hàm thêm các tương tác kinh tế trên môi trường số, đặc biệt là để tạo môi trường pháp lý thuận lợi cho các mô hình kinh doanh đột phá, sáng tạo.
Người ta nói rằng cuộc cách mạng công nghiệp rân thứ tư là cuộc cách mạng về thể chế. Quốc gia nào chù động thiết kế lại thể chế kinh tế phù hợp thì quốc gia đó sẽ có lợi thế lớn trong việc chủ động tham gia vào cuộc cách mạng công nghiệp lần này và định vị mình trong nền kinh tế mới đang hình thành trên toàn cầu.
Nền kinh tế số  cần một hạ tầng số  mạnh. Việc xây dựng hạ tầng số cho nền kinh tế, đặc biệt là hạ tầng dữ liệu dùng chung trên nền tảng hạ tầng dữ liệu của chính quyền số  và sự tích hợp hiệu quả các hạ tầng dữ liệu của các tổ chức kinh tế, xã hội giúp các doanh nghiệp chuyển đổi số  nhanh hơn và ít tốn phí hơn. Khi chuyên sang nền kinh tế thực-số, để đàm bào lòng tin (trust) trong các giao dịch trên môi trường số  rất cần các dịch vụ xác thực, định danh của chính quyền, ngoài ra doanh nghiệp sẽ cần thêm rất nhiều dịch vụ thông tin, dịch vụ dữ liệu trên nền tảng dữ liệu của chính quyền số. Kinh tế số  dựa rất nhiều vào tinh thân đổi mới sáng tạo của cộng đồng doanh nghiệp. Tuy vậy tốc độ và hiệu quả của chuyển đổi số  kinh tế phụ thuộc rất lớn vào chính quyền số  và xã hội số. Nếu người tiêu dùng không thể trở thành các công dân số, chính quyền vẫn hoạt động thủ công với thể chế  quản lý kinh tểcũ thì không thể xây dựng thành công kinh tế số.
Kinh tế số  là kinh tế trên môi trường thực-số. Chuyển đổi số kinh tế đòi hỏi sự đổi mới sáng tạo trong việc chuyên dịch cơ cấu kinh tế theo hướng thông minh hoá, đổi mới phương thức vận hành và quản trị dựa trên kết nối sâu rộng, chia sẻ và dùng chung dữ liệu. Các yếu tô quyết định thành bại là an ninh-an toàn, con người, thể chế  và công nghệ. Chuyển đổi số  kinh tế không chi là đẩy mạnh ứng dụng công nghệ thống tin mà là quá trình tái cấu trúc lại toàn bộ nền kinh tế để khai thác hiệu quả các tiến bộ về công nghệ.","Kinh tế số là nền kinh tế dựa trên các công nghệ kỹ thuật số để tạo ra, phân phối, giao dịch và quản lý giá trị. Nó bao gồm việc sử dụng Internet, điện toán đám mây, dữ liệu lớn, trí tuệ nhân tạo và các công nghệ khác để chuyển đổi cách thức hoạt động của doanh nghiệp, tương tác với khách hàng và tổ chức xã hội. Kinh tế số có thể được chia thành hai loại chính: kinh tế truyền thống (truyền thống) và nền kinh tế mới (nền kinh tế mới).",,
Định nghĩa về kinh tế số là gì?,paraphased,,,"Kinh tế số là một khái niệm khó định nghĩa và đo lường cụ thể do có nhiều cách nhìn khác nhau. Tuy nhiên, theo Bukht & Heeks thì ""Kinh tế số là một phần của nền kinh tế dựa vào hoặc chủ yếu dựa vào các công nghệ số với mô hình kinh doanh về hàng hóa số hoặc dịch vụ số"". Khái niệm này được định nghĩa ở mức độ rộng nhất như sau: ""Nền kinh tế số bao gồm tất cả các doanh nghiệp, dịch vụ có mô hình kinh doanh chủ yếu dựa trên việc mua bán hoặc cung cấp các sản phẩm, dịch vụ số hoặc các thiết bị và cơ sở hạ tầng hỗ trợ"". Nói một cách đơn giản thì kinh tế số là nền kinh tế làm trên môi trường thực-số với công nghệ số.",,
Thế nào là kinh tế số?,paraphased,,,"Kinh tế số là một phần của nền kinh tế dựa vào hoặc chủ yếu dựa vào các công nghệ số với mô hình kinh doanh về hàng hóa số hoặc dịch vụ số, bao gồm tất cả các doanh nghiệp và dịch vụ có mô hình kinh doanh chủ yếu dựa trên việc mua bán hoặc cung cấp các sản phẩm, dịch vụ số hoặc các thiết bị và cơ sở hạ tầng hỗ trợ.",,
Kinh tế số được hiểu là gì?,paraphased,,,Kinh tế số được hiểu là các ngành truyền thống đang cố gắng bổ sung công nghệ số vào hoạt động của mình.,,
