question,type,paraphased_q_score,context,answer,answer_score,paraphased_q_answer_score
Cơ sở để xây dựng kế hoạch số hóa là gì?,root,,"Việc số hóa của môi tổ chức trong quá trình chuyển đổi số là không thê tránh khỏi. Nhưng cần số hóa như thế nào, lựa chọn gì và vào lúc nào để số hóa, đâu là những yếu tố dẫn dắt việc xây dựng kế hoạch SỐ hóa của tổ chức?
Không có con đưòng chung cho mọi tổ chức khi xây dựng kế hoạch số hóa, nhưng theo chúng tôi, một số điểm sau đây có thê gợi ý cho việc này ở mọi tổ chức:
Nguyên lý cơ bản là số hóa nhằm tạo ra dữ liệu, tạo ra co hội số cho hoạt động của tổ chức trong môi trường thực-số, nhằm tạo ra sản phẩm mới, giá trị mới.
Cần có sự kết nối cấp độ số hóa với cấp độ khai thác co hội số khi lập kếhoạch số hóa. Cân nắm bắt mô hình và quy trình hoạt động sử dụng chuẩn dữ liệu gì và thế nào trong cách làm việc mới khi lập kế hoạch số hóa.
Mô hình và quy trình hoạt động có thể thay đổi và điều chỉnh trong thực tế và do đó kế hoạch số hóa cũng cần điều chỉnh theo.
Số hóa làm môi trường thực-số trở nên phong phú hơn, làm cho tổ chức giàu tài sản hơn, nên luôn cần nghĩ đến việc tố  chức, lưu trữ và bảo vệ dữ liệu số hóa. Đó là việc chứa dữ liệu theo cơ sở dữ liệu kiểu nào, có dùng blockchain để bảo vệ không...
• Những câu hỏi cụ thể cần đặt ra là:
- Những quy trình nghiệp vụ hay thủ tục hành chính nào đã và sẽ được tin học hóa và sẽ chuyên sang môi trường thực-số?
Thông tin về mức độ số hóa đã làm, cần làm nhưng chưa được làm?
Dữ liệu số hóa sẽ được dùng như thế nào?
Cần phải số hóa gì thêm? Vào lúc nào?
Khó khăn của số hóa là gì? Số hóa tự động được ở mức nào? Tiêu chuẩn chất lượng của số hóa thế nào? Bảo mật của dữ liệu số hóa ra sao?
- v.v.","1. Tạo ra dữ liệu, tạo ra cơ hội số cho hoạt động của tổ chức trong môi trường thực-số, nhằm tạo ra sản phẩm mới, giá trị mới.
2. Kết nối cấp độ số hóa với cấp độ khai thác cơ hội số khi lập kế hoạch số hóa.
3. Nắm bắt mô hình và quy trình hoạt động sử dụng chuẩn dữ liệu gì và thế nào trong cách làm việc mới khi lập kế hoạch số hóa.
4. Mô hình, quy trình có thể thay đổi và điều chỉnh trong thực tế nên cần điều chỉnh theo.
5. Số hóa làm môi trường thực-số trở nên phong phú hơn, làm cho tổ chức giàu tài sản hơn, nên luôn cần nghĩ đến việc tố  chức, lưu trữ và bảo vệ dữ liệu số hóa.
6. Xác định quy trình nghiệp vụ hoặc thủ tục hành chính đã được tin học hóa và sẽ chuyển sang môi trường thực-số; thông tin về mức độ số hóa đã làm, cần làm nhưng chưa được làm; dữ liệu số hóa sẽ dùng như thế nào; cần phải số hóa gì thêm? Vào lúc nào?
7. Xác định khó khăn của số hóa, tự động hóa ở mức nào và tiêu chuẩn chất lượng của số hóa cũng như bảo mật của dữ liệu số hóa ra sao.",,
Nền tảng để hình thành kế hoạch số hóa là gì?,paraphased,,,"Nền tảng để hình thành kế hoạch số hóa bao gồm việc xác định đích đến của doanh nghiệp trong tương lai, mô tả trạng thái hiện tại bằng cách phân tích các quy trình và sản phẩm nghiệp vụ cũng như mức độ ứng dụng CNTT. Việc này đòi hỏi sự kết nối giữa cấp độ số hóa với khai thác cơ hội số, nắm bắt mô hình và quy trình hoạt động sử dụng chuẩn dữ liệu gì và thế nào trong cách làm việc mới khi lập kế hoạch số hóa. Ngoài ra, cần xem xét các yếu tố dẫn dắt như tạo ra dữ liệu, tạo ra cơ hội số cho hoạt động của doanh nghiệp, thay đổi và điều chỉnh mô hình và quy trình hoạt động, tổ chức lưu trữ và bảo vệ dữ liệu số hóa cũng như những câu hỏi cụ thể liên quan đến quá trình số hóa.",,
Yếu tố chính để phát triển kế hoạch số hóa là gì?,paraphased,,,"1. Xác định mục tiêu của việc chuyển đổi số trong tổ chức.
2. Đánh giá hiện trạng về công nghệ, cơ sở hạ tầng và nguồn lực sẵn có.
3. Phân tích các quy trình nghiệp vụ và thủ tục hành chính để xác định những lĩnh vực cần được tin học hóa hoặc tự động hóa.
4. Xác định dữ liệu nào sẽ được tạo ra từ quá trình chuyển đổi số và cách sử dụng chúng hiệu quả nhất.
5. Xây dựng lộ trình, kế hoạch thực hiện các dự án chuyển đổi số phù hợp với mục tiêu phát triển chung của tổ chức.",,
Những nguyên lý nào là cơ sở để lập kế hoạch số hóa?,paraphased,,,"1. Tạo ra dữ liệu: Nguyên lý này nhấn mạnh rằng mục tiêu chính của chuyển đổi số là tạo ra các dữ liệu, thông tin mới phục vụ cho hoạt động và phát triển của tổ chức trong môi trường thực-số.
2. Tạo cơ hội số hóa: Chuyển đổi số nhằm tạo ra những cơ hội mới để doanh nghiệp khai thác giá trị từ việc sử dụng công nghệ số, thúc đẩy sự sáng tạo và đổi mới trong quá trình kinh doanh.
3. Kết nối cấp độ số hóa với cấp độ khai thác cơ hội số: Khi xây dựng kế hoạch chuyển đổi số cần xem xét mô hình và quy trình hoạt động của tổ chức sẽ được sử dụng như thế nào, dữ liệu gì để tạo ra các sản phẩm mới, giá trị mới trong môi trường thực-số.
4. Điều chỉnh theo sự thay đổi: Kế hoạch chuyển đổi số phải linh hoạt, có thể điều chỉnh khi mô hình và quy trình hoạt động của tổ chức phát triển hoặc thay đổi trong quá trình thực hiện.
5. Bảo vệ dữ liệu số hóa: Tổ chức cần xây dựng các biện pháp bảo mật để đảm bảo an toàn cho thông tin, tài sản số được tạo ra từ chuyển đổi số.",,
Khó khăn và thách thức của chuyển đổi số là gì?,root,,"Thay đổi thói quen là khó khăn lớn nhất của chuyển đổi số.
Loài người đã quen với môi trường thực nhiều thế kỷ. Chuyển lên môi trường thực-số là thay đổi thói quen. Thay đổi thói quen là một việc khó và là một việc lâu dài.
Thay đổi thói quen của một cá nhân đã khó. Thay đổi các thói quen ở một tổ chức sẽ còn khó hơn và phụ thuộc rất nhiều vào quyết tâm của lãnh đạo.
Nhận thức và nhận thức đúng là thách thức lớn nhất với chuyển đổi số quốc gia.
Mặc dù Nghị quyết số 52/NQ-TVV ngày 27/9/2019 của Bộ Chính trị đã đặt nhiệm vụ “đổi mới tư duy, thống nhất nhận thức"" lên thành nhiệm vụ đầu tiên, nhận thức về Chuyển đổi số vào lúc này như vẫn chưa “chạm"" đến nhiều lãnh đạo cấp cao nhất ở nhiều cơ quan chính phủ, tổ chức và địa phương... vốn là những người cần thấu hiểu tầm quan trọng của chuyển đổi số, cố gắng tìm hiểu để hiểu về chuyển đổi số, đế từ đó xác định chuyển đổi số là nhiệm vụ quan trọng mình phải làm, phải dẫn dắt cả tổ chức của mình để thay đổi. Nhận thức của những người có trách nhiệm cao nhất ở các tổ chức sẽ lan tỏa đến nhận thức của các thành viên, lan tỏa đến mọi người trong xã hội.
Đơn cử một ví dụ có thật. Khi Chính phủ yêu cầu các bộ ngành và
địa phương phải nhanh chóng xây dựng chiến lược và đề án chuyển đổi số của mình theo Chương trình chuyển đổi Số quốc gia. Lãnh đạo một Bộ nọ đã giao cho một Vụ chuẩn bị. Vụ lại giao cho một vài chuyên viên, viết được dăm trang với nhiều lỗi chính tả và gửi đi các đon vị trong Bộ để lấy ý kiến. Lãnh đạo nhiều đon vị lại giao cho nhân viên của mình góp ý. Rút cục, chiến lược và đề án được xây dựng theo đúng quy trình, nhưng không mang chút ""hồn cốt"" nào của Bộ về chuyển đổi số của chính mình, của ngành mình phụ trách.","1. Rào cản lớn nhất cho chuyển đổi số chính là thể chế.
2. Cải cách thể chế chưa bao giờ dễ dàng, nhanh chóng; cải cách thể chế trong thời đại chuyển đổi số lại càng khó khăn hơn.
3. Một số thách thức chủ yếu trong cải cách thể chế đối với chuyển đổi số:
a) Tư duy và nhận thức của cán bộ quản lý nhà nước về chuyển đổi số còn hạn chế, chưa theo kịp xu thế phát triển;
b) Hệ thống pháp luật, chính sách thiếu đồng bộ, không phù hợp hoặc cản trở quá trình chuyển đổi số.
c) Cơ sở hạ tầng kỹ thuật và công nghệ thông tin chưa đáp ứng được yêu cầu của chuyển đổi số.
d) Thiếu nguồn nhân lực chất lượng cao về chuyển đổi số;
đ) Khó khăn trong việc đảm bảo an toàn, an ninh mạng cho quá trình chuyển đổi số.",,
Những trở ngại và thách đố trong quá trình chuyển đổi số là gì?,paraphased,,,"Những trở ngại và thách thức chính của quá trình chuyển đổi số bao gồm thiếu nhận thức về tầm quan trọng của chuyển đổi số, sự phản kháng từ các bên liên quan truyền thống, hạn chế trong việc tiếp cận dữ liệu chất lượng cao, vấn đề bảo mật và quyền riêng tư dữ liệu, cơ sở hạ tầng công nghệ không đầy đủ. Ngoài ra, còn có những thách thức trong việc tích hợp hệ thống cũ với nền tảng mới, thiếu kỹ năng số của nhân viên và sự phức tạp khi quản lý thay đổi quy trình vận hành hiện tại.",,
Thách thức chính khi thực hiện chuyển đổi số là gì?,paraphased,,,"1. Thách thức về nhận thức và tư duy: Nhiều người còn chưa hiểu rõ hoặc có định kiến với công nghệ, dẫn đến việc không sẵn lòng áp dụng các phương pháp mới trong hoạt động của tổ chức mình.
2. Thách thức về nguồn lực tài chính: Chuyển đổi số đòi hỏi đầu tư đáng kể vào cơ sở hạ tầng kỹ thuật và đào tạo nhân sự, gây khó khăn cho một số doanh nghiệp hoặc tổ chức có hạn chế về ngân sách.
3. Thách thức trong việc tích hợp các hệ thống cũ với công nghệ mới: Nhiều đơn vị đã có sẵn những hệ thống quản lý riêng biệt, đòi hỏi phải được tích hợp và đồng bộ hóa để đảm bảo hoạt động trơn tru khi chuyển đổi số.
4. Thách thức về an ninh mạng và quyền riêng tư dữ liệu: Khi các tổ chức ngày càng phụ thuộc vào công nghệ kỹ thuật số, nguy cơ bị tấn công mạng hoặc xâm phạm thông tin nhạy cảm cũng tăng lên, đòi hỏi phải có biện pháp bảo mật mạnh mẽ để ngăn chặn những rủi ro này.
5. Thách thức trong việc thu hút và giữ chân nhân tài: Chuyển đổi số thường yêu cầu các bộ kỹ năng mới và chuyên môn mà không phải tất cả mọi người đều sở hữu hoặc sẵn sàng học hỏi, dẫn đến khó khăn cho doanh nghiệp tìm kiếm và duy trì lực lượng lao động có tay nghề cao.
6. Thách thức trong việc thích ứng với những thay đổi nhanh chóng của công nghệ: Công nghệ liên tục phát triển, đòi hỏi các tổ chức phải theo kịp xu hướng mới nhất để đảm bảo tính cạnh tranh và hiệu quả.",,
Các khó khăn trong việc chuyển đổi số là gì?,paraphased,,,"1. Rào cản thể chế
2. Cải cách thể chế phức tạp
3. Khó khăn, trở ngại chính của lĩnh vực khi làm chuyển đổi số
4. Năng lực số cần thiết cho cán bộ và người hoạt động trong lĩnh vực
5. Đặc điểm văn hóa sáng tạo trên môi trường thực-số",,
"Tại sao an toàn, an ninh trên môi trường thực-số hết sức quan trọng?",root,,"Thông tin ngày nay đã trở thành một thứ tài sản vô hình nhưng cực kỳ quan trọng, thậm chí quan trọng hơn nhiều so với các tài sản hữu hình khác. Có những tổ chức, doanh nghiệp mà thông tin đã là tài sản vô hình có giá trị nhất. Chẳng hạn, Facebook không có phóng viên nào nhưng lại có số lượng độc giả lớn hơn nhiều so với các tờ báo điện tử và có giá trị tương ứng lớn hơn nhiều. Grab không có chiếc taxi nào nhưng lại có giá trị lớn hơn nhiều so với các hãng taxi truyền thống. Amazon hay Alibaba không sở hữu cửa hàng nào nhưng lại có giá trị lớn hơn nhiều so với các siêu thị.
Đối với mỗi cá nhân, tổ chức, các cuộc tấn công mạng nhằm đánh cắp thông tin, bí mật nhà nước, bí mật kinh doanh không chỉ gây ra thiệt hại kinh tế lớn, mà còn có thể làm phá sản cả một doanh nghiệp, thậm chí ảnh hường nghiêm trọng tới quốc phòng, an ninh của cả quốc gia. Sự cố an toàn, an ninh mạng còn làm xói mòn hình ảnh, thương hiệu, gây ra những thiệt hại dai dẳng.
Đối với cả xã hội, an toàn, an ninh mạng có vai trò tạo dựng niềm tin. Nếu không có niềm tin thì sẽ mất tất cả.
Chính vì vậy, an toàn, an ninh mạng được coi là điều kiện tiên quyết cho chuyển đổi số.","An toàn, an ninh trên môi trường thực-số là rất quan trọng vì nó đảm bảo sự sống còn của hệ thống và ngăn chặn các xâm nhập bất hợp pháp từ bên ngoài. Khi kết nối tăng lên trong một thế giới thực-số, rủi ro về an toàn, an ninh mạng cũng tăng lên, do vậy an toàn của hệ thống mang tính chất sống còn. An toàn thông tin và an ninh hệ thống bao gồm việc giữ gìn và bảo vệ cơ sở vật chất, máy móc, dữ liệu và thông tin trên hệ thống (an toàn) cũng như ngăn chặn được những xâm nhập bất hợp pháp từ bên ngoài vào tổ chức, đặc biệt là trong môi trường thực-số.",,
Vì sao an toàn và an ninh trong môi trường thực-số lại quan trọng?,paraphased,,,"An toàn và an ninh trong môi trường thực-số rất quan trọng bởi nó đảm bảo sự sống còn của hệ thống, bao gồm việc giữ gìn và bảo vệ cơ sở vật chất, máy móc, dữ liệu và thông tin trên hệ thống (an toàn) cũng như ngăn chặn được những xâm nhập bất hợp pháp từ bên ngoài vào tổ chức, đặc biệt là trên môi trường thực-số. Môi trường thực-số cho phép con người và tổ chức mở rộng kết nối với nhiều người và tổ chức khác, tạo nhiều cơ hội để phát triển, nhưng đồng thời môi trường thực-số cũng là nơi các cá nhân và tổ chức bị xâm nhập trái phép nhiều hơn nếu hệ thống không được bảo vệ đúng cách. Do đó, trên không gian thực-số mọi tổ chức phải hết sức quan tâm và luôn tìm cách đảm bảo an toàn an ninh mạng của mình.",,
Lý do gì khiến an toàn và an ninh trên môi trường thực-số trở nên thiết yếu?,paraphased,,,"An toàn và an ninh trên môi trường thực-số trở nên thiết yếu vì nó cho phép con người và tổ chức mở rộng kết nối với nhiều người và tổ chức khác, tạo nhiều cơ hội để phát triển. Tuy nhiên, điều này cũng khiến các cá nhân và tổ chức bị xâm nhập trái phép nếu hệ thống không được bảo vệ đúng cách. Vấn đề an ninh-an toàn thông tin có vai trò quan trọng trong tính bền vững của doanh nghiệp như một hệ thống, cần nhận thức rằng vấn đề này vốn vẫn tồn tại kể cả trong môi trường vật lý. Khi chuyển đổi để trở thành một doanh nghiệp số, mọi hoạt động của doanh nghiệp sẽ phụ thuộc rất lớn vào hệ thống kỹ thuật số và vấn đề an ninh-an toàn càng trở nên quan trọng. An toàn, an ninh thông tin cần được đảm bảo trên cả ba khía cạnh: sản phẩm, dịch vụ; quy trình vận hành; phương thức quản trị.",,
Tại sao việc bảo đảm an ninh và an toàn trên môi trường thực-số lại cực kỳ quan trọng?,paraphased,,,"Việc bảo đảm an ninh và an toàn trên môi trường thực-số là cực kỳ quan trọng vì nó cho phép các cá nhân, tổ chức mở rộng kết nối với nhiều người và tổ chức khác, tạo cơ hội để phát triển. Tuy nhiên, điều này cũng khiến họ dễ bị xâm nhập trái phép nếu hệ thống không được bảo vệ đúng cách. Môi trường thực-số đặt ra những vấn đề mới về an ninh-an toàn trong hoạt động của từng lĩnh vực kinh tế-xã hội và an ninh-an toàn số quốc gia phụ thuộc vào an ninh-an toàn số trong hoạt động của từng lĩnh vực. Vấn đề an ninh-an toàn thông tin có vai trò quan trọng trong tính bền vững của doanh nghiệp như một hệ thống, cần nhận thức rằng vấn đề này vốn vẫn tồn tại kể cả trong môi trường vật lý và mọi máy tính trong doanh nghiệp đều có kết nối trực tiếp hay gián tiếp với internet. Do đó, việc bảo đảm an ninh và an toàn trên môi trường thực-số là rất quan trọng để duy trì sự bền vững của các cá nhân, tổ chức và hệ thống số.",,
Nhiệm vụ và giải pháp trong Chương trình chuyển đổi số quốc gia là gì?,root,,"Quyết định số 749/QĐ-TTg đặt ra sáu nhiệm vụ và giải pháp tạo nền móng để thực hiện Chuyển đổi số quốc gia:
Chuyển đổi nhận thức: Khẳng định tầm quan trọng của nhận thức trong đó người đứng đầu chịu trách nhiệm trực tiếp về chuyển đổi số trong cơ quan, tổ chức, lĩnh vực, địa bàn mình phụ trách... Gắn các mục tiêu, nhiệm vụ về chuyển đổi số với nghị quyết, chiến lược, chương trình hành động, mục tiêu, nhiệm vụ phát triển kinh tế - xã hội, bảo đảm quốc phòng, an ninh của các cấp, các ngành...;
Kiến tạo thế chế: Theo hướng khuyến khích, sẵn sàng chấp nhận sản phẩm, giải pháp, dịch vụ, mô hình kinh doanh số, thúc đẩy phương thức quản lý mới đối với những mối quan hệ mới phát sinh;
Phát triển hạ tầng số: sẵn sàng đáp ứng nhu cầu bùng nổ về kết nối và xử lý dữ liệu, các chức năng về giám sát mạng lưới đến từng nút mạng và bảo đảm an toàn, an ninh mạng được tích hợp sẵn ngay từ khi thiết kế, xây dựng;
Phát triển nền tảng số: Mang tính thúc đẩy nhanh tiến trình chuyển đổi số diễn ra một cách tự nhiên, khai mở giá trị mới, mang lại lợi ích rõ ràng cho xã hội. Nền tảng số được tích hợp sẵn các chức năng về bảo đảm an toàn, an ninh mạng ngay từ khi thiết kế, xây dựng;
Tạo lập niềm tin, bảo đảm an toàn, an ninh mạng: Niềm tin vào tiến trình chuyển đổi số, hoạt động trên môi trường số thông qua việc hình thành văn hóa số, bảo vệ các giá trị đạo đức căn bản và bảo đàm an toàn, an ninh mạng, bảo vệ dữ liệu cá nhân;
Hợp tác quốc tế, nghiên cứu, phát triển và đổi mới sáng tạo trong môi trường số: Thu hút nhân tài, hợp tác với các tổ chức, doanh nghiệp lớn trên thế giới để nghiên cứu, phát triển và đổi mới sáng tạo.","Các nhiệm vụ và giải pháp trong chương trình chuyển đổi số quốc gia bao gồm nâng cao nhận thức về chuyển đổi số, phổ cập kỹ năng chuyển đổi số và phát triển nguồn nhân lực chuyển đổi số. Chương trình cũng hướng đến việc giúp người dân tự học các kỹ năng số qua nền tảng học trực tuyến mở đại trà (MOOCs) được truy cập miễn phí hoặc thông qua tuyên truyền, hướng dẫn sử dụng dịch vụ công trực tuyến và dịch vụ số trong lĩnh vực y tế, giáo dục, thương mại. Ngoài ra, chương trình còn bao gồm việc tổ chức các khóa đào tạo, bồi dưỡng, tập huấn về chuyển đổi số, công nghệ số cho đội ngũ cán bộ lãnh đạo, quản lý, cán bộ làm công tác tham mưu chuyển đổi số trong cơ quan nhà nước đến cấp xã và các tập đoàn, tổng công ty nhà nước.",,
Các nhiệm vụ và giải pháp trong Chương trình chuyển đổi số quốc gia là gì?,paraphased,,,"1. Nâng cao nhận thức về chuyển đổi số thông qua tuyên truyền, hướng dẫn sử dụng dịch vụ công trực tuyến và dịch vụ số trong lĩnh vực y tế, giáo dục, thương mại.
2. Phổ cập kỹ năng chuyển đổi số cho người dân bằng cách giúp họ tự học các kỹ năng số qua triển khai xây dựng nền tảng học trực tuyến mở đại trà (MOOCs) được truy cập miễn phí.
3. Phát triển nguồn nhân lực chuyển đổi số thông qua việc tổ chức đào tạo, bồi dưỡng, tập huấn về chuyển đổi số và công nghệ số cho đội ngũ cán bộ lãnh đạo, quản lý, cán bộ làm công tác tham mưu chuyển đổi số trong các cơ quan nhà nước đến cấp xã, các tập đoàn, tổng công ty nhà nước.
4. Xây dựng một đề án chuyển đổi số địa phương thống nhất nhưng có tính mở để cập nhật yêu cầu do các đề án của trung ương đề ra khi cần thiết.",,
Chương trình chuyển đổi số quốc gia có những nhiệm vụ và giải pháp gì?,paraphased,,,"Chương trình chuyển đổi số quốc gia bao gồm các nhiệm vụ như nâng cao nhận thức về chuyển đổi số, phổ cập kỹ năng chuyển đổi số và phát triển nguồn nhân lực chuyển đổi số. Các giải pháp được đưa ra trong chương trình thực hiện bao gồm giúp người dân tự học các kỹ năng số qua việc xây dựng nền tảng học trực tuyến mở đại trà (MOOCs) được truy cập miễn phí, tuyên truyền, hướng dẫn sử dụng dịch vụ công trực tuyến và dịch vụ số trong các lĩnh vực y tế, giáo dục, thương mại. Ngoài ra, chương trình còn bao gồm hoạt động quan trọng là tổ chức đào tạo, bồi dưỡng, tập huấn về chuyển đổi số, công nghệ số cho đội ngũ cán bộ lãnh đạo, quản lý, cán bộ làm công tác tham mưu chuyển đổi số trong các cơ quan nhà nước đến cấp xã và các tập đoàn, tổng công ty nhà nước.",,
Những nhiệm vụ và giải pháp nào được bao gồm trong Chương trình chuyển đổi số quốc gia?,paraphased,,,"1. Nâng cao nhận thức về chuyển đổi số thông qua tuyên truyền, hướng dẫn sử dụng các dịch vụ công trực tuyến và dịch vụ số trong lĩnh vực y tế, giáo dục, thương mại.
2. Phổ cập kỹ năng chuyển đổi số cho người dân bằng cách giúp họ tự học trên nền tảng học trực tuyến mở đại trà (MOOCs) được truy cập miễn phí.
3. Phát triển nguồn nhân lực chuyển đổi số thông qua các khóa đào tạo, bồi dưỡng và tập huấn về chuyển đổi số, công nghệ số cho đội ngũ cán bộ lãnh đạo, quản lý, cán bộ làm công tác tham mưu chuyển đổi số trong cơ quan nhà nước đến cấp xã, các tập đoàn, tổng công ty nhà nước.
4. Hoàn thiện thể chế quyết định thành bại của chuyển đổi số quốc gia bằng cách điều chỉnh những quy định và luật lệ đã đặt ra cho phù hợp với môi trường thực-số cũng như bổ sung những quy định và luật lệ mới trước kia chưa có nhu cầu.",,
